,Date,UserName,Location,stars,Message
437,8/13/2016,Kelly L.,louisville-3,4,"Pretty good! They were busy but had a short line. Staff was extremely helpful, but my coconut popsicle was just average. Something I could've gotten from the store for less than $3. Cool atmosphere, though."
438,3/26/2016,Dalton C.,louisville-3,5,Love this cute little shop! First off tax is included in the price which I love! Lots of different options from traditional to more odd flavors (avocado)!!! And $3-$5 for dessert is pretty much a steal now days!!! Excited to try more flavors as it continues to warm up!
439,7/11/2016,Janice F.,louisville-3,4,"Oh, the choices you have to make, so many wonderful flavors.  It's cool, refreshing, and fun to eat. Like a grown up dessert  on a stick that makes you feel young again.  Go for it...."
440,6/13/2016,Darby S.,louisville-3,5,"Took the family, everyone loved it.  Something different and cool on a hot summer day.  The sour cherry was good, but not really that sour.  My kids loved the vanilla and the pina colada."
441,6/3/2016,Robin W.,louisville-3,5,"It was a great place for a quick cool down. Lots of popsicle variety in the store, including things for vegans."
442,7/27/2016,Sarah N.,louisville-3,4,so many delicious choices!  my favorites so far have been the jasmine green tea and the buttermilk.  my only complaint is the positioning of counter/door/line.  there are so many fans of this great spot that the line becomes pretty long.  its not immediately clear how many lines there are at any given time and there's really no good way for the line to form without blocking the limited seats available and the entrance.
443,8/15/2017,Kelly P.,lexington,5,"Steel City Pops is awesome! We've loved them since they opened their doors in Louisville. So, when I heard they moved into the Summit in Lexington I was totally down to stop in. I've since been to this location twice, and both stops were great. The line has been long both times, as it often is at the Louisville location; however, they move really quickly, so the wait has never been too long. The flavors are all great and I've never tried one I haven't enjoyed. I highly recommend Steel City Pops!"
444,8/13/2017,Rick G.,lexington,5,"Who would've thought a popsicle joint would be a thing! But these aren't just any popsicles! There are unique flavors closer to texture of popsicles and there are others closer to ice cream pops. Being a chilihead, I went for the spiciest thing on the menu which was Pineapple Jalapeño. That might sound gross for a popsicle but the sweet and spicy combo was actually quite delightful.You can also order them by the boxes. While a great summer idea, I think this treat will be great anytime you're looking for a different treat!"
445,7/29/2017,Niki V.,lexington,5,"Yasssss to this soooo much. We got four, oatmeal cream pie, passion fruit, vanilla chocolate chip, and passion fruit. I had to try all of ours but might have been a bit stingy with sharing mine. I had the oatmeal cream pie, the taste was great- I only wish the cookie pieces were spread out instead of just clumped in the middle. But if that's my only ""complaint"" it's really not even a complaint, just a suggestion. I would get it again for sure. The strawberry lemonade was probably the best out of the four we tried. My son loved it, he won't try anther. Please don't stop this flavor The passion fruit was a bit too sour but my husband enjoyed it. My youngest son enjoyed the vanilla chocolate chip (as did I) but didn't care for the cookie part when it got to the cookie. He enjoyed all parts of it.Oh and these bars are huge!!! We didn't do the extra drizzles and such, but have that on the radar for the next time. I love that they have rewards too.  GO GET A POPSICLE ALREADY!!!!Update: We've been 3 times this weekend. We've also tried Peanut Butter Pie, cookies and cream, and Avocado. Avocado is my favorite now, dipped in white chocolate and covered in pistachios. If you like avocado like a true millennial, eat it!!!! But dip it for sure."
446,9/22/2017,Shannon D.,lexington,5,"Tonite was our first visit, and when we saw the line, we really asked ourselves if any popsicle could be worth waiting in a line THAT long.    Well, these ones certainly are.   They offer a wide array of fruit pops ranging from something as simple as peach to something more daring like pineapple jalapeño.  On the creamy side, you also have lots of options.  My daughter tried the chocolate pop, and I tried the special - a salted caramel cheesecake pop.   Both were fantastic, and we cannot wait to go back and try a fruit pop.   And when all is said and done, we were quite impressed with how quickly the line moved, so don't let that deter you."
447,10/1/2017,Elaine D.,lexington,4,"A perfect day for an icy treat.  What to choose?  I'm a purist when it comes to ice cream.  I don't necessarily want add-ons.  I spied the pineapple jalapeno pop, which intrigued.  Anything with jalapeno is good with me.  Since this flavor is going away, I had to try it now.  Very refreshing.  Loved the bits of jalapeno, and the heat they brought gave the pop a pop.  Many more unique flavors to try -- and I will."
448,7/15/2017,Kaylyn E.,lexington,4,"I was a little skeptical of Steel City Pops at first. I mean only serving popsicles? However, I have returned already three times. Any time I am in the Summit I can't seem not to stop by and get a pop! I have tried the cookies and cream, brownie, watermelon, and strawberry lemonade. So far my favorite is the strawberry lemonade, however, if you are in the creamy pop mood go with the cookie dough! It is like a frozen cookie inside of creamy ice cream.For a little extra you can get it dipped, dusted, or drizzled with other toppings! Pops range in price, but typically average 3 to 4 dollars a pop. So it can add up if you get several. I think of it like getting an ice cream cone or blizzards at other places (its a dessert or specialty dessert). Plus their ingredients are all natural so you know what your are eating and that always is worth the extra to me. My husband and I can split one and it is usually the perfect amount of sweet after dinner.Also be sure to sign up for their rewards by just giving them your number. In no time at all you could get a free popsicle. My only concern with Steel City Pops is their seating. Their seating is very limited and bar style (meaning you sit side by side and face outside the window.) This could be tricky with large groups and/or in the colder months!"
449,9/17/2017,Emily B.,lexington,4,"I love the location (The Summit is quickly becoming one of my favorite Lexington areas), and the popsicles here are very good!  Prices are a bit high (especially if you want any sort of topping), and I'd love to see more creative flavors, but definitely worth a stop on a hot day."
450,6/5/2017,Rob B.,lexington,4,"Steel City Pops has now opened a location in Lexington at The Summit at Fritz Farm. Steel CIty Pops offers gourmet popsicles---and they are delicious. Price per popsicle begins at $3. You can also have your choice of flavors dipped or dusted and topped with various toppings, which costs a bit more.Steel City Pops are based on unique sweets which the founder discovered several years ago at a similar established serving pops called Mexican paletas--more commonly known as pops. According to Steel City Pop's founder, ""These delicious paletas were gourmet, brightly colored, all natural, and healthy, too--simply unlike anything we'd ever had. When we tasted these amazing pops, we decided everyone needed to know about this.""Fast-forward a few years and Steel City Pops was founded. I had tried them in Louisville about a year ago and have eagerly anticipated their opening at The Summit here in Lexington. Open only a few days they are already doing a very steady business and kids and adults alike look very happy seated inside and outside the store. The servers behind the counter were very fast and happy to explain the various options and available flavors. You can also buy them by the dozen or even in larger quantities. I sampled two separate pops on my visit. The coconut was terrific. So good in fact, I decided to try a second flavor: Vanilla Bean dipped in dark chocolate sprinkled with graham cracker crumbles. Also very good. There are various dips and ways to ""dust"" your pop. There are also fruity flavor choices and available flavors change based on various items in season. Steeel City Pops is a welcome addition to Lexington's food scene and as summer arrives, you just might have to wait in line. But they are worth the wait."
451,9/12/2017,Carlos H.,lexington,4,"While I've given up dairy for the most part, I must admit that I'm a fan of this place. I've been multiple times, and I've found the staff to be very friendly and the prices very reasonable. I've tried the chocolate brownie and oatmeal cream pie cookie pops, and both of them are so amazing that even typing about them is making my mouth water right now. Be warned, though, these pops will start to melt on you when you're about halfway through them. So keep some napkins nearby!"
452,7/8/2017,Christina C.,lexington,5,"This place is amazing. I feel like I never run into artisan popsicle shops so I was pleasantly surprised when my friend and I saw so many people at Summit having a popsicle.I decided to get the avocado popsicle. It was fantastic. I loved it so much. It had some lime in it too. It really tasted like mostly avocado, instead of having lots of ice. It is a quality popsicle.There are adirondack chairs outside to sit on, which is great on a sunny day!"
453,9/28/2017,Ranada W.,lexington,4,Loved the pops we got - family of 3 for just under $20 is a bit steep in my opinion - but I'll be back. They were good - the long line let's you know it's a hit.
454,7/18/2017,Stephanie C.,lexington,4,"What a fun new place in the Summit - a perfect destination on a hot day. There were lots of unique flavors, some fruity and some rich and decadent. After much deliberation I chose the Lavender Lemonade since it was the first to catch my eye, and my husband chose the Oatmeal Creme Pie. My choice was perfect for the 90+ degree day, as it was very refreshing. My husband liked his, but regretted not getting a fruit flavor that would have been more refreshing than filling. The shop itself is a bit small, and can be a little difficult to navigate (if you have not been there before) if it is busy, as there is no clear indication of where you order and where you pay. There is limited seating inside, which may present issues during cold weather, but there is also outdoor seating available to enjoy your popsicle on a warm day. Don't forget to grab some napkins! In addition to the fun flavors available, you can choose to have your popsicle dusted, dipped or drizzled in a variety of ways. This, of course, costs extra, and our popsicles were $3.25 each with no additions, which I thought was a little expensive (only reason I did not go with a 5 star rating). They do offer a loyalty program, with which you earn a free popsicle after you purchase ten. Despite the price, I cannot wait to return and try more of the flavors!"
455,6/10/2017,Teresa M.,lexington,4,"Fantastic pops, but definitely not inexpensive - we got two regular pops (strawberry lemonade and oatmeal cream pie) and one dipped pop (strawberry cream dipped in chocolate) and it came in around $11. Employees were very friendly, but the line was disorganized - could use some more direction on how to order/pay. Also could use more seating in the shade. We will definitely be back!"
456,7/8/2017,Kathryn P.,lexington,5,"Steel City Pops is a great place to go. It is is the new Summit shopping area so it great place to grab a popsicle and sit around the beautiful new area. The only problem is you can't bring in the popsicle to most of the shops, so buy it as one of you last stops.The popsicles are pretty drippy so grab a couple napkins.  They have cornhole set up right outside and a fountain right around the back. Super pretty and super tasty. It goes around $3 to $6 depending on the toppings you get."
457,8/14/2017,Angela M.,lexington,4,"These are really good, but not sure they are worth waiting in a long line. I like how you can get something light a fruity, but then add a drizzle of chocolate if you want."
458,7/26/2017,Aviva C.,lexington,5,"Absolutely delicious popsicles at a reasonable price. Very convenient setting at the center of The Summit. Fun place to hang out, too. I had coconut and look forward to trying every flavor."
459,8/12/2017,Jennifer B.,lexington,5,"Caroline was so helpful in suggesting an amazingly delicious pop that she dipped, drenched and drizzled for me. Suggest the peanut butter dipped in dark chocolate-this is better than a Reese."
460,7/28/2017,McCall D.,lexington,4,"Yum! Fun, different and refreshing. You can pick from a variety of pops, some being fruit based and other cream or cookie bases. Their menu also not only shows the calories per pop, but has a pop for everyone and their dietary needs. Once you choose your pop, you can keep it plain and simple or dip, drizzle, dredge AND/OR dust it. Countless combinations to try!"
461,8/14/2017,Chrissy L.,lexington,4,"This is a really cool concept to have flavored, fresh popsicles with a variety of toppings available. I had the peaches and cream and watermelon ones and they were definitely delicious. You can add some toppings, like salt on watermelon, for free but dipping in chocolate and such cost an extra dollar. I like how they also give you little containers to put your popsicl in for the drips, that even has a little indentation for the popsicle stick! This is a great dessert place for the summer, but slightly expensive for a popsicle to go regularly. Will definitely be back to try more flavors!"
462,7/15/2017,Heather M.,lexington,5,"So good! Had the Oat Meal Creme Pie Pop, tasted just like the Little Debbie creme pie but popsicle style! Bonus - you can dust, dip, drizzle your pop in a variety of ways! There was line out the door but goes quick so don't let that stop you from going. They range $3 to $4 and extras are are $1.  They also have a loyalty card."
463,7/14/2017,Timothy F.,lexington,5,"If you are looking for a quick treat, but don't want the 500 Calories of an ice cream cone, I definitely recommend steel city pops. In the new Fritz Farm shopping complex, they offer classic fruity pops, creamy pops, and cookie pops. And don't think you're going to get the generic grape, lemon, cherry flavors. Make sure you branch out and try the blueberry basil or pineapple jalapeño. Coupled with a great sitting area right outside, it makes for a great family friendly way to close out a summer evening."
464,7/31/2017,Shelby R.,lexington,5,This place is amazing! I'm definitely coming back. I got the watermelon and it tasted just like it. It was sweet too! My boyfriend went with me and he got the peanut butter pie. He liked it a lot and he doesn't even like popsicles. His even had cookie in it. These are the best popsicles I have ever had!
465,6/16/2017,Tonya M.,lexington,4,The watermelon pop is amazing! Tastes just like a frozen slice of watermelon on a stick. My kids got strawberry lemonade & root beer. Strawberry lemonade was good though not as good as mine and the root beer was very sweet and mostly tasted like sugar according to my son. At $3 and up a pop I think they should offer a sample before you purchase. Maybe a small frozen piece? The cream pops looked good and I am looking forward to trying the coconut pop next. Overall a great treat yourself spot!
466,7/20/2017,Sara H.,lexington,5,"Wow! We were blown away by how good these were! We went to the area for a little Anniversary lunch date and stumbled upon Steel City Pops. I had the cucumber lime (it was delicious!!) and my husband has the blueberry basil, also a great choice! We have a feeling that all of them are just as good as the ones we had today so we will definitely be back to try more!"
467,6/28/2017,Emily M.,lexington,4,"I should start out by saying I am partial to the Summit, not because it's new but it's my kind of scene! Steel City Pops is located in the center area, a cute little greenery place that has a fire pit and Adirondack chairs. You have the choice between a cream base which is like a normal popsicle with a ton of amazing flavors (get the coffee), then they have a regular consistency popsicle. The regular popsicles are mostly fruit flavors, so perfect when it's a million degrees outside. I had the grueling decision between passion fruit or basil watermelon. Basil watermelon was the pop of choice. They are super cheap ($3) and very tasty! You can totally tell it's fresh flavors and not too sweet. I had the anticipation for my pop to be really sweet, like most watermelon flavors, I was wrong they really like to use the flavors of the natural fruit and herb to enhance the taste. I recommend this place for any and all events"
468,8/8/2017,Bill B.,lexington,5,Delicious product with many choices of flavors for their pops. Excellent location if the parking lot isn't too busy.  I would recommend going later at night. Staff is very friendly and professional but their product is expensive.
469,7/6/2017,Beth P.,lexington,5,"Very good! Taste like fresh fruit, great flavors. Haven't had any toppings because the pops are good enough."
470,6/14/2017,Michele V.,lexington,4,Great popsicles. Lots of flavors. I had the rootbeer and my friend had the cucumber lime with a dusting of salt. Delicious! Great idea.  Not much seating. If too hot or cold no where sit.
471,10/3/2017,Frances A.,dallas-2,5,"Me: ""how many stars would you give this place?""Friend that brought me: ""6.""Me: ""but Yelp only has 5 stars.""Friend: ""yes. 6 out of 5.""This place is delectable! Lots of options, flavors frequently updated. I loved the rosemary/plum. You can dip your popsicle in different chocolates + toppings. Excellent flavor- can a popsicle be gourmet???? These sure were."
472,10/1/2017,Ali B.,dallas-2,5,I went last night after truck yard with my sister and her kids. They have benches outside to enjoy your pop's. I couldn't decide on 2 flavors and they offered an awesome cold pack take away so I could enjoy one later. I did decline because I'm not that into sweets. I ordered the raspberry lemon after the cashier suggested against it when I asked. Why did I ask and not take the suggestion is beyond me! It was super tart. Which honestly I typically like but if you are wanting to be able to complete your popsicle maybe not choose this one. My niece polished it off no problem. Everyone else loved their pops. The creamy ones seemed to be the favorites. My date got something like.. cookies and cream. I tried to ste[e]l it. Pun intended. I'll take the suggestion next time. Service was good. There are benches outside to enjoy your popsicle and their gift cards are super cute!
473,9/16/2017,Annie F.,dallas-2,5,"Cheap. Healthy. I've never had a bad popsicle from them (granted, I've never had their creamy popsicles).Flavors I've tried:*Lemon - really tart, you'll love it if you like tart things*Peach - tastes like you're biting in a real peach!*Lavender lemonade - you can actually have the aftertaste of lavender, not as vibrant in color as the other popsicles if you're looking for that instagram picture*Avocado - frequently sells out, people rave about itTip: sign up for their reward program!"
474,8/17/2017,Kimberly J.,dallas-2,4,"Excellent pops!I'm a huge fan of Las Paletas in Nashville and so when we saw Steel City Pops in Dallas, we definitely wanted to check this place out. Parking around here can be a bit difficult to find. There is some street parking. Indoor and outdoor seating is available. Employees are super sweet and helpful. Pops are each $3 but if you get 4 pops it's $11 and you get a bag that keeps your pops cool till you get home. Their pops were packed with flavor and quality ingredients are used. They were super refreshing on a hot day.If you're looking for a cool treat that is sure to make your tastebuds happy, Steel City Pops is your place."
475,8/15/2017,Salena C.,dallas-2,3,"Popsicles are the perfect treat for a hot day, but I think we missed the appeal here. I ordered a Lemon Lavender popsicle out of the fruit section (think water-based instead of cream-based), and I was disappointed to find absolutely no Lavender taste whatsoever! Don't get me wrong, it was a great lemon popsicle for sure, but don't label it something it's not! BF ordered a pineapple jalapeño, and thought there was way too much kick for it to be enjoyable (probably because they let it ripen all the way until it turned red, as seen by the red specks in the popsicles). I probably wouldn't return because they aren't true to their flavor profiles, but if you're going for a basic flavor, it's worth a $3 treat."
476,8/8/2017,Sam G.,dallas-2,5,"Tried Steel City Pops while in Birmingham for work and have been a fan ever since!I am a fan of the fruit based pops and went with a Strawberry Lemonade and my girlfriend got the cookie dough, dipped in chocolate. Both pops were excellent and service was friendly and fast. I will definitely be back."
477,9/12/2017,Joey L.,dallas-2,4,"Amazing pops for a sweltering day. I'm usually a creamy dessert kind of person, but my appetite was wiped so I opted for a fruity pop. My companions also chose something fruity and we were all delighted with our choice. I got the lavender lemonade. The lemonade became overwhelming after a few bites and the lavender got lost, but it was a delicious choice regardless. There was definitely a line of constant patrons when we went in the afternoon so be prepared. Also, it's a pretty small space so be prepared to eat your pop outside."
478,9/1/2017,Sarah A.,dallas-2,5,"This was my second time enjoying Steel City Pops, but my first at this location (I had previously had them at their cart in Klyde Warren Park). The parking in this area on a Friday night is hectic, so my husband dropped me off in front while he drove around the block.As I walked up I noticed cameras everywhere. The lady that was being filmed out front asked if I was there for dessert. I informed her I was, and she said that the North Texas Honda Dealership would be treating me to a popsicle as she handed me a coupon card. I thanked her and made my way inside to even more cameras and representatives from Honda. The cameras were a little overwhelming as they filmed me ordering and speaking with the employees, but I was grateful that they were treating me to dessert.The ladies working at Steel City Pops were very helpful in recommending flavors. I personally prefer the creamy pops to the fruity ones, so I took their recommendations of the Strawberries and Creme and the Coffee flavored popsicles. We were not disappointed! My husband loved the Strawberries and Creme, and the Coffee pop reminded me of Starbucks flavored ice cream. Delicious! Steel City Pops is a great choice on a warm summer night!"
479,8/16/2017,Alexandra G.,dallas-2,4,I love this little shop - super cute and good popsicles! A nice little walk for a sweet treat after dinner on Greenville. It's always packed but the line goes quick so don't let that dissuade you from stopping in.I'd recommend their oatmeal cookie dipped in milk chocolate - delicious!My only complaint is that the outside and entryway smell like sour dairy. It's unfortunate especially if you want to sit outside. Maybe a good scrub is all it needs?
480,6/26/2017,Rucha M.,dallas-2,4,"Drove by this place when we were dining in lower Greenville and decided to keep some room for a visit. Very much like an ice cream parlor but for popsicles. They have 3 kinds with fruit based, cream based, and cookie based. The interesting thing is that they have the calorie count which was nice. Given it was my first time I asked for some recommendations and the servers were very happy. They suggested the raspberry lemonade over the lavender lemonade. Will have to come back to try the creamy and cookie based ones. The raspberry lemonade was very fresh and light and tasty. It did have a lot of raspberry seeds which I wasn't expecting. Overall very tasty dessert spot especially if your in the lower Greenville area. Not sure if I would make a trip out of going. If they have a food truck I would look out for it. Perfect for a hot summer night!I think during the day you could probably see them making the popsicles. They have a small indoor and outdoor space to sit."
481,8/18/2017,Jen D.,dallas-2,5,"Gotta thank my Dallas friend for bringing me here on my visit! The popsicles were soooooo good. It's ridiculous how delicious a well-made popsicle can be but Steel City Pops has got the recipe down. The store itself is smaller with some counter seating inside but a lot of people just grabbed there's to eat on the go. The staff was friendly and super helpful in describing the various flavors. The Strawberry lemonade was the best; nice and refreshing on a hot Texas day. I sat inside and ate my $3 popsicle and thought this place must make some killer margins on these sales. The cream popsicles, that come with cookies inside of them, were like $4.50. Kudos to the business geniuses behind Steel City Pops. I'll definitely make an effort to stop by when I'm back in Dallas! Maybe there should be a store in Chicago?"
