,Date,UserName,Location,stars,Message
0,5/28/2017,Tim M.,birmingham-2,5,"This is Birmingham's version of Nashville's Las Paletas..... except these could be better than Las Paletas! And they are a great value!Steel City Pops is by far the best dessert joint that I will try this year. The popsicles are good size and basically fills your whole mouth and they are served firm enough that you can sit there, lick, and salivate for 10 solid minutes on a single popsicle.Flavors - this is where they take creativity to the next level: Avocado, Pineapple jalapeno, Pistachio, and the list goes on. In 1 day, I had the pineapple jalapeno, cookies & creme, strawberry lemonade and loved them all.If I went to Las Paletas in Nashville, I would probably pay 10% more to get 15-20% less product."
1,8/16/2017,Kayla S.,birmingham-2,5,"I LOVEEEEE Steel City Pops! It's like you're having a treat but not eating too horribly. The location on 280 and the one in Homewood are both very convenient for me with one being close to my work and the other close to home. I've had great experiences at the 280 location. Whoever's working is always super nice and quick! My favorite flavor is the Avocado and my least favorite is the Pineapple Jalapeno. I know you're thinking, ""Avocado?! Seriously???"", but you HAVE to give it a chance! It's a creamy, citrusy and sweet pop that is very satisfying. I didn't like the Pineapple Jalapeno because there was just wayyyy too much heat on the end but then again if you really like heat, then you'll love that!"
2,5/2/2016,Lisa H.,birmingham-2,5,"Where else in The Ham can you buy frozen confections out of a spaceship-like recreational vehicle? The fourth store that opened, the Highway 280 location is definitely the most unique Steel City Pops for sure. Beyond coolness. And there's even a drive-thru. Steel City Pops, please come to Atlanta; I'd pick you over King of Pops any day.I love how the SCP team is always coming up with new flavors. Personally, I think the more innovative ones are the winter flavors, but summer is always great too. I finally tried a cookie pop ($4.50) for the first time during this visit. It was a brownie frozen into a chocolate pop. So yummy and fudge-y, you won't even be able to tell that it's all gluten-free. The other folks in my party went fruity and got blackberry, blood orange, lavender lemonade (a new offering), lime, and raspberry lemonade ($3 each). No complains from anyone, just content slurping, even though I assured them they could swap flavors if they really despised their selections.Some drawbacks to this location is that there only appears to be one person working, and there is no indoor seating. There is a small discount if you buy four pops. Check the SCP website to get an idea of what flavors are available and for nutritional information. Don't forget to get your Frequent Buyer Card punched so you can earn a free pop!"
3,9/17/2016,Justin W.,birmingham-2,5,"100% worth it. I was a doubter the first time. Then I wised up and realized these popsicles are so delicious. I generally go with creamy, and often a cookie version because I like those types. Any fruit ones I have tried are also good. They put the legit fruits and foods in these; not some engineered flavors. It's goodness."
4,12/13/2016,April D.,birmingham-2,5,"Love Steel City...  I just stopped by last night & got a 4 pack.  My favorite flavors are Avocado Lime in the summer which is Key Lime Pie if you close your eyes... Peanut Butter, Coffee, Pumpkin Pie, Carrot Cake, Chocolate Mint, Pistachio...   Yum!!!  My wallet feels lighter after I pay ... they are not cheap, people!!!  But I do it.  They are so yummy."
5,9/28/2016,Jamie S.,birmingham-2,5,I love all of the pops and the staff is always friendly and ready to serve  with a smile I get bags of 4 such a sweet treat!!
6,7/29/2016,Tiffany W.,birmingham-2,5,"Drove by their Airstream trailer several times before stopping to check it out.  Glad I did - charming Popsicle stand with lots of classic and upscale flavors, and quality ingredients.  I thoroughly enjoyed my peach cream pop. Can't wait to try more of their flavors!"
7,9/20/2016,Brandy D.,birmingham-2,5,My office loves taking a mid-afternoon break and going to the 280 location near Greystone. Yum!
8,5/11/2016,Hailey S.,birmingham-2,5,Such a good Popsicles!!! All flavors are very authentic and true to their names! Highly recommended. The best are raspberry lemon and coconut
9,8/8/2015,William R.,birmingham-2,5,Calling these popsicles doesn't do them justice. These are so good and we love the the variety of gourmet flavors! The buttermilk flavor is so good out of the creamy flavors along with strawberry lemonade out of the fruit ones. The chocolate chip vanilla cookie pop is by far the best in our opinion. It was like cookie dough wrapped in creamy vanilla flavor. We were familiar with steel city pops from living in Fort Worth so it was nice to discover them on a road trip through Alabama.
10,6/22/2016,Wes H.,birmingham-2,5,"Absolutely one of our favorite places to get a treat. They use the highest quality ingredients, and the staff is always friendly and helpful. I love how they change flavors according to what's in season, besides their staple flavors which they have year-round. Best popsicles I've ever had!"
11,3/31/2015,Casey W.,birmingham-2,5,"This place is so cute! I took my sister here yesterday to grab a Popsicle and we both kept talking about what a good idea it was, especially for the coming summer. I had passion fruit and she had strawberry lemon. Both were listed as under 100 calories and were very tasty. Very neat place."
12,3/15/2015,Tiffany G.,birmingham-2,5,Drive thru Popsicles... What more can you ask for?  I love this place!  The Pineapple Jalapeño and Cucumber Lime flavors taste like Heaven.  Yummers!!!
13,7/18/2014,Shelby R.,birmingham-2,5,"I was told by a friend that I had to stop here, and I am sooo glad I did! Who would have thought a Popsicle business could be so popular. It was so hard to decide what  flavor I wanted. Do I want pineapple or chocolate? Avocado or orange? Buttermilk or coconut? Blueberry basil or peanut butter? Peanut Butter! And I was soo glad I did! It was the best Popsicle I have ever had and you can quickly tell that it is made with fresh ingredients. They have fruity flavors like Blood Orange, Pineapple, Strawberry Sour Cream, and Blue Berry Basil. They also have creamy flavors like Avacado, Peanut Butter, Caramel, and Coconut. They regularly have new flavors. I can not wait to go back and try some more! This is a must stop place, and they have a drive thru!"
14,4/18/2015,Michael C.,birmingham-2,5,"Good ice pops with a drive through , what else could I rate it. Glad to have it here in the summer time"
15,6/2/2015,Mary J.,birmingham-2,5,What a fun place! An Airstream trailer outfitted as a popcicle shop. Flavors are numerous and interesting. I had a Maypaw pop--whatever that is. And is was scrumptious. A little sweet and a little tart and very refreshing. Husband had a blackberry pop and it tasted like berries just pick off the vine. Conveniently located. Easy to get to. and very friendly staff.
16,6/24/2017,Kat C.,birmingham,5,"What a great find! This place was awesome. Locally made.  Friendly staff. Unique flavors and traditional flavors as well. I had avocado and it was amazing! My sons had Watermelon and another had Chocolate. They were also great - I snuck a bite ;-). At $3 a pop, it isn't cheap, but the flavor and all natural ingredients are worth the price."
17,7/31/2017,Jeremy B.,birmingham,4,This tasty  popsicle shop is located in the Summit outlet mall off of HWY 280. There's multiple locations throughout the metro area. It's a great spot to chill on hot southern summer day. There's a variety of creamy & fruity popsicle flavors to select from. I prefer the creamy popsicles since I'm a big lover of ice cream. My go to is the chocolate popsicle that has a brownie in the middle. It's amazing  & I know you'll love it! Now I discovered there's locations popping up in Hotlanta!
18,8/17/2017,Julie S.,birmingham,4,"If you're in the area looking for a cold treat, this is definitely a good stop.  Enjoyed our popsicles!  On the pricey side, as our total came to around $19 for the four of us."
19,3/25/2017,Shaquita Y.,birmingham,5,"Chocolate (creamy) is never a let down. Tastes like your favorite soft serve ice cream in popsicle form.Out of all the available flavors I've only tried chocolate and strawberry lemonade because I can't seem to try anything else because these are the best tasting things ever.  In a liquid form, I'm sure the strawberry lemonade would be the best lemonade in a cup."
20,1/5/2017,Benjamin Y.,birmingham,5,"It's about to snow but I drove to steel city pops to get some ice cream anyway. My fiancee and I were glad to see the open sign. Surprisingly, there were several people in/out of Steel City Pops. I guess I wasn't the only one. On this visit, we picked coffee and black sesame seed. They instantly became my favorite flavors. They were gone before you know it. I like Steel City Pops because they don't put any unhealthy ingredients and you can taste the goodness in every bite. Great for everyone - both kids and adults."
21,3/25/2017,Amanda B.,birmingham,4,"Always super friendly and of course great popsicles!!! Only downside, which I know some people like is the creamy popsicles like chocolate leave a film in your mouth. But easy too look past for me because the flavor is so good. Their fruit varieties don't seem to have this same effect.  Love the little bags they give when you buy several to go we have never had a problem with them starting to melt before we get them home and  in the freezer."
22,9/5/2016,Maggie K.,birmingham,4,"This place is located inside a plaza. Tried this place with couple of friends while in Birmingham...I dint know pops could be so flavorful with wired combinations. Some are fruity while others are creamy.I tried the buttermilk after I stood blank for almost five minutes, to choose one pop. Trust me the buttermilk one was so so good than the others. So creamy and dint taste like buttermilk, it was more of eating a frozen cheesecake. My friend got a mango, it was good too. Much on the fruity flavor side. My hubby got a guava, I dint like it much but was just okay after tasting buttermilk n mango.The store is a little cozy with a little outdoor space."
23,8/25/2016,Debbie C.,birmingham,4,"I didn't realize there was one at the Summit! Much easier to park, haha. It's larger than the one by Little Donkey and (I think...) this location has more seating. :) My family always requests for Pops when they visit from Miami.Keep up the great work!!"
24,6/20/2016,Paisley B.,birmingham,5,"Straight up gooood! On a hot summer day of course I had to get a Chocolate steel city pop. I don't know what I was expecting, but it didn't taste anything like it. Instead it was flat out luscious! What a neat texture. I mean, I am truly fascinated with this pop. It's not quite ice cream and not quite a popsicle...I guess that's why they call it a creamy pop. Cuz they have some 'chew' to them like a creamy, fudgy, frozen custard bar on a stick. Look. I'm just saying it was good! Chocolatey. Chewy. And good. Service is good too. The place is simple. Easy to walk in and out. So you can march on enjoying your treat like a bosslady. At $3 a pop go and get yourself one."
25,4/9/2017,Victoria T.,birmingham,5,"I can't rate anything less than 5 stars for this place. Not only are the popsicles made fresh, but the menu changes daily. You can literally never run out of flavors to try. The service is always super quick and friendly. I always ask a billion questions about the flavor choices and the staff is always very patient. I ended up ordering the blueberries and cream. It was yum! Pieces of blueberry in the pop so if your weird about textures you might want to get something a bit more creamy. Beware, the prices for a Popsicle are a bit steep, $3.50 to $4.50 depending on what you get. A bonus, they give you a freezer bag if you are getting a few to go, which is awesome."
26,6/26/2016,Cynthia L.,birmingham,5,"Delicious! We tried avocado, mind blowing, blood orange, super refreshing, strawberry lemonade, on point, & lavender lemonade, whata combo.You really can't go wrong here perfection on a stick."
27,3/14/2017,Sadia D.,birmingham,5,This place is a true gem! I have never been able to find good popsicles in Birmingham before but these really do the trick. My favorite is coconut but the guava is my go to when I'm calorie counting. They have so many great flavors that are always changing and are quite affordable at $3 each. It is nestled near the Carmike theater which makes it a great post movie snack.
28,8/9/2015,Gregory S.,birmingham,5,"Delicious popsicles at fair prices! Unique flavors that are fresh and natural. I like how some flavors have a fruity tang while others are more smooth and creamy. Either way, they hold up against the heat in that you won't get melted juices all over your hand...nice! A must visit."
29,5/8/2017,H K.,birmingham,5,"I love these popsicles! I haven't had a flavor that I didn't like. Buttercream, strawberry lemonade, and peanut butter are my favorites."
30,5/5/2015,Raj D.,birmingham,5,"This place is absolutely amazing. I tend to travel often to Birmingham and this is my first stop after landing. The store itself is rather small but there are some chairs and tables located outside. This place makes home-made organic popsicles that you can die for. They recently began making ""cookie"" pops made of icecream and either a brownie/cookie in the middle. You can get a cool freezer bag if you chose to take them home with you. Try the: mango habanero, avacado, cookie, papaya, pineapple habanero, COCONUT (my personal favorite), and the habiscus. Honestly, you cannot go wrong. The price is a bit high for a popsicle but this is far from your ordinary popsicle and absolutely worth the price. I WILL ABSOLUTELY BE BACK!!!"
31,7/23/2015,Katy P.,birmingham,4,"It's a store that specializes in Popsicles. POPSICLES! There are enough options to please everyone, plus they have the calorie count with the item name. There's fruity, creamy, even cookie Popsicles. I had the blueberry basil Popsicle and it was delicious. My only complaint is that it was full of blueberry skin chunks and I was chewing them constantly. The flip side of that is it means they use real, whole blueberries. I would rather have that than unnatural flavorings. I do wish they had seating inside since it feels like a million degrees outside and I was paranoid about my Popsicle melting! I definitely recommend this place if you are in the area! It won't disappoint."
32,3/3/2016,Pauline S.,birmingham,5,I would give this place 6 stars if I could! Think the best Popsicle you have ever had and than turn it up to 10!The coconut dipped in chocolate or the blueberry  basil... If it's hot get the buttermilk... Place and service is great! Plus- can't think of a gift to give that family member who has everything... They have family gift cards!
33,4/10/2016,Avriel F.,birmingham,5,"This is my new favorite place ever! They have an awesome mix of comforting, familiar flavors and funky ""never would've thought of that"" flavors. The creamy pops are my favorite, with the coconut being my #1 go-to indulgence every Friday evening after work. Also, all of the flavors are natural (without added dyes or preservatives, I believe), so it's a relatively healthy option. The young, upbeat staff and the rustic-style atmosphere adds to the overall experience. The shop is pretty small and doesn't offer much seating, but it just encourages you to enjoy your treat outdoors when the weather is nice. The staff is also really considerate, offering ice packs with your pops if you've got a longer distance commute. Really, stop by this wonderful place while you're stuck in 280's gridlock 5 o'clock traffic. It'll remove your headache, and add some enjoyment to the rest of your ride home :)"
34,4/16/2017,El L.,birmingham,5,I found this place randomly and it changed my life. This is the absolute best place on earth and live too far to go regularly. If you are near this place you must go!
35,12/5/2015,Dominique V.,birmingham,4,"Good, rich, unique flavors! I enjoy their seasonal pops very much. This particular trip I had the cinnamon apple pop. I could have been eating an apple pie for all my taste buds knew! My only reason for dinging them a star is that they put shavings if the fruit's skin in their fruity pops sometimes. I know that's nit picky of me, but I'd personally rather have the meat instead of the skin in my fruity pops. It may not be the case with very fruity pop. The atmosphere is great. They don't have a very big place to sit and eat, so we typically grab pops and go walk. It's great stop after a movie, or after a day of shopping in the Summit."
36,5/14/2016,Nadine E.,birmingham,5,It's in a strip mall but what a great idea! Officially obsessed. The sundae bars are a LOT to handle. great place with fresh pops!
37,12/12/2015,Cat A.,birmingham,5,"I am a fan! Every season when the flavors change, I have to try all the new ones. If you try a flavor you don't like, they'll switch it out for one you do like. I've only had one pop I didn't like there, but when I went to try and purchase a new pop instead of finishing that one, they wouldn't let me pay and just gave me a different flavor.This is really a gem in Birmingham and a must try for anyone living or visiting the area. It's a great end to a date or a day out or just because."
38,9/6/2015,Jessica M.,birmingham,5,"If you haven't had a Popsicle from here yet your crazy. With multiple locations and boths at many events you can't miss them. They have sweet, savory, creamy, and sometimes a mixture of two. My first was a pineapple jalapeño, and I was hooked. The fruit ones are good but the creamy ones are my favorite. Plus they have Popsicles with gluten free brownies in them, Amazing! Coffee is what I get most. Then today I saw banana pudding and I melted. The kicker is that these little delights are made from natural and sometimes local ingredients. So I don't feel quiet to bad since this is more a healthy indulgence. Plus I can support local vendors at the same time. If I am ever eating at the summit I was save room for dessert, so I can go to steel city pops after."
39,2/22/2014,Heather B.,birmingham,5,"No doubt this is a popular spot, given there were only about 20 people outside the tiny storefront when I walked up. I really, REALLY wanted to try that Bacon bourbon molasses thing that has me intrigued, but alas, not on today's menu. I typically go for the fruity pops over the creamy ones, and I was gravitating towards the blood orange.... Until the pineapple  jalapeño spoke to my soul. The guy behind the counter jokefully asked me if I was sure that's what I wanted...I guess I must've ordered with authority. When I told him I was pretty sure, he offered to let me have a blood orange if I hated this one (hence five stars!). He didn't have to give me a free popsicle, I was beyond pleased with my choice! I'm sure I will come by here A LOT  this summer."
40,7/12/2015,Catesby D.,birmingham,4,Very good! I had the coffee and my brother had the chocolate. They were both very good. Had a variety of options and I appreciated that they had the calories listed for all of them.
41,8/24/2013,Ee Vonn Y.,birmingham,4,"$3 per popsicle but it's a novelty so what can you expect?I got the strawberry fig which had a sharp, distinct taste that I felt like I was almost eating soft frozen strawberries.It was that good. The service was prompt and quick. My person gave me good recommendations when I couldn't decide between pineapple jalapeno and strawberry fig. And I was glad I got what I picked. I wanted to share it with my friend but I didn't think she'd appreciate the drool."
42,10/16/2014,Brian H.,birmingham,5,"Sure, $3 a Popsicle is pricey, but where else are you going to find a Maple Bacon Bourbon Popsicle?I had never been here before, but had heard it was good.  Ended up getting 2 dozen pops, each a different flavor.  The service was great in helping us pick flavors, and they packed them in a foam cooler/box with some ice packs to make sure we got home without them melting.Overall, the quality of the pops is great.  Some flavors we didn't like as much (sweet potato pecan we felt had an undesirable ""frozen mashed potato"" texture), but we were big fans of ones like Cherry Sour Cream.It was a nice treat, and if we lived in the area, I'm sure we'd be in for a pop from time to time."
43,8/21/2016,Lisa F.,birmingham,5,Awesome Popsicle!  I had the buttermilk..........which takes just like cheesecake!  Yummy!
44,6/27/2016,W D.,birmingham,5,What a wonderful selection of unique flavor a! So far every one I've tried has been amazing! Most are gluten and allergen free!
45,8/4/2013,Lacy W.,birmingham,3,"I've been 3 times. There are pros and cons:PROS: Most of the flavors I've tried are good.          If you don't like a flavor, (I couldn't even eat the raspberry because there were so many seeds) they will GIVE you another flavor of your choice.          Plenty of flavors to choose from.CONS: Only three benches outside to sit And on weekends it's always crazy crowded.             The popsicle sticks are not long enough at all. Very hard to hold with only a little one inch piece of the stick at the bottom. Especially for kids. You either end up dropping it or making a big mess.             High prices for a popsicle. I know the ingredients used are good, expensive ones, but it's just more than I want to pay for a popsicle. You can make the same things at home for a lot less."
46,12/23/2015,Harry L.,birmingham,5,"A wonderful quick stop to get delicious pops to drench your thirst at any time, especially on weekends when visiting Birmingham. Don't forget a cooler to bring some extra home."
47,6/12/2014,Lily L.,birmingham,5,Holy bananas these are amazing! Today was our first stop in after being recommended by a local. It was love at first bite with the coconut and the vanilla bean. Both were equally creamy and delicious. The coconut has has toasted shreds towards the base of the Popsicle which gave it a little something extra. Next I'm trying the avocado sweetened slightly with sugar and lime. Please bring these to Arizona!!
48,6/17/2013,Caleigh R.,birmingham,4,"Had the chocolate pb tonight---very good, but melted very quickly.  My friend had raspberry lemon and we shared. Good combo to go back and forth with. I hope the do strawberry balsamic again soon!:)"
49,7/5/2013,Garrett I.,birmingham,2,"I have only been here once but so far, I dont know what the hype is.  It tasted like a to popsicle like the one I got out of an Eddy's box from the grocery store.  I listened to reviews and got the most popular one (strawberry balsamic).  I will give it another try to try to understand the hype.  Have I experienced a better popsicle store...no.  BUT, there are plenty of better places to drop $4 on a quick sweet treat."
50,2/14/2014,Lauren S.,birmingham,5,Best dessert place  in town. Great service. They catered my wedding an did a great job!
51,6/23/2013,Amber G.,birmingham,3,"Love the unique flavors!  The buttermilk is awesome, but my fave is the peanut butter.  I do prefer the Homewood location.  It's a bit crowded at this branch.  And do be very careful parking.  Parents are not always watching their children, and kids tend not to watch out for cars.  There are only benches to sit on along the walls, and you can bet that some mom with a couple unruly kids will be taking up the entire stretch of sitting."
52,6/29/2014,Amy J.,birmingham,3,The manager at the local Jim'N Nick's Bar-B-Que recommended Steel City Pops and we're glad she did. The popsicles were a bit pricey but delicious. I especially liked my Cherry Sour Cream popsicle and the place is clearly popular because it was very crowded!
53,"8/13/2013
            





Updated review",Darleen O.,birmingham,4,"This is a rewrite for the management team at Steel City Pops.  In this day and age when most businesses rely on social network feeds, its great to know that Steel City Pops cares enough about their product and brand to reach out.  Received a response from Andrea who was more than gracious with her response.  KUDOS to Andrea.  With that being said, I will take her suggestion and return on my own to perhaps try the buttermilk. I am more than willing to give this establishment another try as its refreshing to know Steel City Pops TRULY does care about their customer's experience."
54,6/15/2015,Andy M.,huntsville,4,"I thought my creamy Coconut popsicle was excellent.  However, my wife said she liked her Chocolate pop even better.  I'm actually inclined to give the whole place five stars, but that might set your expectations way too high, as the only menu items are gourmet frozen pops and bottled water.  I wonder what they do in cold weather.   Our frozen pops were an even $3 each, tax included.   Try this new place quickly, before all the kids find it.  I expect it will become very popular during hot summer afternoons and evenings."
