,Date,UserName,Location,stars,Message
1258,4/7/2017,John D.,houston,5,"I heart these pops.Whether you get them fruity or creamy, you can get them dipped in chocolate and or nuts and it's delish. The little game room with a ping pong table is good for letting the wee ones get some energy out of their system. Plus it's walking distance to some pretty good restaurants. If you're in the Heights, this is a primo dessert pick."
1259,9/22/2016,Kevin G.,houston,5,"I LOVE this place!  I originally went to the Greenville location in Dallas a couple weeks ago after I grabbed a bowl of tasty ramen from Wabi House.  This location in Houston is definitely a lot more spacious!  They have a separate area for guests to play ping pong or just chill.So far, I've tried the horchata, chai tea and mango pops.  One can definitely tell these pops are homemade.  Which, by the way, are made in house.  I could actually taste pieces of mango and not just the juice!  So refreshing in this Texas summer heat.  I think; however, I'm more of a fan of their creamy pops like the horchata and chai tea.  I mean, c'mon.  Horchata and chai tea pops?  Genius!Be sure you ask them for one of their Frequent Buyer Cards.  Buy 10, get the 11th one free.  All the POPs are $3 each.  Don't be complaining or saying, ""Oh, that's too expensive.""  Shoot you pay 5 buckeroos on coffee at Starbucks."
1260,9/1/2016,DeHorne S.,houston,4,"The epitome of hipster joint. Cool looking contemporary, minimalistic faculty, dog friendly porch, lack of adequate parking and concrete benches inside are all ingredients for a hipster joint.The selection is simple, this place serves popsicles with a variety of interesting flavors, such as hibiscus, pineapple jalapeno, blueberry basil and much more. They also supply you with calorie counts to let you know what you're putting in your body. There was a line when I went on a Sunday afternoon that went rather quickly.They also have more creamy popsicles if that is what you would rather have. Note that is i about 100 calories more than your fruit based ones. The seating area is rather interesting, there are places to sit immediately when you finish putting in your order that is next to the wall. In the next room, you can witness how the popsicles are made. They also have a porch that can also serve as a general room. There is randomly a ping pong table in there as well. Overall great neat little place with hipster ""artisan popsicles""."
1261,6/21/2017,Ashley T.,houston,5,"This is an interesting business concept. Who would think that selling Popsicles ONLY could be a winner? I love all the different flavors that you can get and loooove how you can outfit the different Popsicles (i.e. adding cookies, chocolate, etc). All of the calorie information is posted so it's up to you to make a bad decision...or a better one. Haha. I opted for making a bad decision - getting a strawberry lemonade pop. Only 97 calories. It was great, but should have enhanced it with some chocolate..or something. But will save that for next time. The pop was surprisingly bold with flavor and did not taste ""too sweet.""  Definitely a great spot if looking to get a refreshing, cost effective dessert."
1262,7/12/2017,J B.,houston,5,"steel city pops is amazing!! My coworker introduced me to this little gem in the heights. The service is amazing. The line moves swiftly and the pops are delicious. My first time there I got the pineapple jalapeño. *insert praise dancing gif^! It wasn't overwhelmingly spicy due to the jalapeños and the pineapple tasted amazing!! I ordered four more to go for my family.  The avocado, strawberry cream, vanilla bean and chocolate. The togo packaging kept my popsicles frozen on my trip back to Pearland. The vanilla bean was very well received. I tried the avocado and it taste just like a nice creamy avocado. The space is also really nice and they have a ping pong table to play while you enjoy your popsicles. I also like the fact that they give you a popsicle rest instead of putting in on the plastic or a napkin. I will definitely be a frequent visitor at Steel City Pops."
1263,8/9/2017,David N.,houston,4,I had a chance to experience their pops via white linen nights.  They had a nice little cart to help us deal with the heat and humidity.  Their passionfruit was very flavorful.  It was $1 less than their competitors too.  I'll have to visit their store at some point to try out some of their other items.
1264,8/1/2016,Jinkie G.,houston,3,My son and I got the cantaloupe pop and the strawberry shortcake pop. Both were just OK. Nothing spectacular. Hopefully we'll be back to try more flavors.Quick service. Good amount of seating.
1265,7/23/2016,John L.,houston,5,"Best popsicles ever. Some flavors are weird, like avocado lime, but don't be scared. Everything is amazing. Haven't tried a flavor I didn't like yet!If you're watching calories get one of the fruity bars. Otherwise, creamy is the way to go. Steel City is my new go to place in the heights for dessert... at least for now. (Sorry Fat Cat)"
1266,4/7/2017,Marya S.,houston,5,Such a cute popsicle place with spacious. So glad my coworkers took us here after lunch. I had the sweet tea popsicle and it tastes exactly like sweet tea. My coworker had the coconut one. Both are delicious! Definitely coming back.
1267,6/18/2017,Iris T.,houston,5,My first time going and It did not disappoint. I went to the one in Lower Greenville (Dallas area) all the workers were very friendly and helpful.
1268,7/2/2016,Lyn N.,houston,5,"I'm sooooo in love with Steel City Pops and so happy they finally opened. I swear I've been waiting since they announced in 2015! Nothing better than delicious, refreshing popsicles in Houston heat. They got fruity pops, creamy pops, coffee, and t shirts. The glass windows to their kitchen allows you to watch their popsicle makin magic. I tried avocado and strawberry lemonade at their Dallas location so I can't imagine it being that much different here. I prefer avocado though. Flavors tried here in best tasting order: watermelon, champagne white tea, cookies & cream, peach cream, mango, vanilla bean, peach, strawberry shortcakeStrawberry shortcake has a slab of cookie dough in the middle so it was more like strawberry & cookies. Watermelon, champagne white tea, & mango is refreshing and not too sweet. Peach cream is creamy but not too heavy. Vanilla bean tastes like dryers ice cream on a stick. It was really creamy and a smidgen too sweet. Peach had real fuzzy peach bits which is good but I wish it was just the flesh. Regardless, they're all worth trying and they change their flavors all the time. P.S. I edit this review each time I try new flavors, and I usually try 4 at a time :) don't judge me. Don't forget your punch card!Edit: they recently added a ping pong table! And for those complaining about the flavors, you can exchange your pop for another flavor if you don't like it! For free!!"
1269,2/15/2017,Sandy A.,houston,5,"I'm kind of in love with the whole concept of Steel City Pops (I mean, just their name is so cool). They make such a variety of flavors, including some pretty unique ones, and have both fruity popsicles and cream based ones. They have amazing customer service and a room for kids to go run around in like crazy while the adults buy and attempt to feed them their delicious desserts. They also have lovely cookie pops.The staff are always super nice and super efficient. They somehow manage to make every customer feel valued and special. Thank you guys!Steel city pops is an experience anyone living in the Houston area should definitely try out. The prices are cheap, parking is usually easy to find, and they make amazing popsicles. Definitely recommend!"
1270,7/1/2016,Nick M.,houston,5,"I've got 99 problems and my 99th review ain't one. Ok, I might be cheating here because I came on the soft opening of SSP and everything was FREEEEEE!  So probably not fair to give this a 5 star review quite yet.  But, to be honest, the pops were pretty tasty! I had an Avocado pop which was creamy, tangy and delicious.  Then I had the Blood Orange which was fruity and super refreshing.  Topped it off with a cappuccino that was good, but coulda been frothier.  The dining room isn't finished yet, just a concrete slab. But the staff were friendly and helpful. I'll be back for a full review later. Come check it out in the now booming northern heights!"
1271,8/14/2016,Ruby D.,houston,5,"I've been once or twice a week since they've opened and would probably come way more if I lived closer. I haven't had a flavor I didn't like. Welllllll...except that jalapeño one but even then it was good, just not what I was wanting. (They'll gladly exchange if you don't like)Staff are hit or miss. Some are great +super personable and others are very slow moving + their age shows. They have that whole frequent buyer card punch system. -Buy 10 individual get one free. -Buy 10 4-packs get one free. Still perplexes me... like, can I buy 4-individual ones and put it in a To go bag?Typically always busy. I've never had an issue with seating though so that's been nice!It's a great addition to the Heights and Houston, in general. The faves so far have been mostly on the creamy side: coconut/horchata/vanilla bean. Blood orange and watermelon are yummies, too. I tell everyone about this place and drag all of em with me. Steel City Pops 4ev"
1272,7/14/2016,Jessica V.,houston,4,"Tucked away in a pretty quaint part of the Heights, Steel City Pops commanded the block. It was a bit larger than anticipated but also had a good number of parking spots. The main/middle room is where you order your pops, the left side is an area to enjoy your pop and the cars passing by, and the right side has a window to watch the employees make the pops. Wish there was more seating in the left side of the establishment though. We sat down on a bench after the family that was there first went back into the main room and got some pretty intense stares from their toddler when they came back.Anyways... at 3 bucks a pop, it's fairly affordable although buying in bulk is probably the better deal. 4 pops in a to-go bag for 11 bucks is their current offer. I came in with my siblings on a Wednesday night and man, that place was packed. Fruity pop: blueberry basil: (3/5) - I usually love blueberries but this pop was just ""meh"". I found myself chewing on blueberry skin more than I would have liked. Fruity pop: blood orange (5/5) - This pop hit the nail on the head. Super refreshing for those hot Houston nights.Creamy pop: vanilla bean (4/5) - As Hong pointed out, the taste was more of an vanilla than a vanilla bean. Be sure to get a frequent buyer/punch card when you stop by!"
1273,8/3/2017,Amanda G.,houston,5,"I've seen lines out the door before but was lucky enough to stop by at open on a Thursday for my 1st visit. A very cute, pleasant and informative lady employee helped with me and my bf's transaction.  I thoroughly enjoyed myself at this super cute lil pop shop. During my visit I heard TLC, Nsync, Spice Girls, Backstreet Boys and other 90's pop music on the radio so as a 30 yr former teeny bopper, I was enjoying myself quite a bit. No shame. I got caught up in the experience but go here! Their flavors our delicious, too!"
1274,7/22/2016,Kathy T.,houston,5,"This is one of my favorite Popsicle places! The Houston location is very spacious, unlike the Dallas one. On the far left, there's a indoor lounge area and far right is an open kitchen. All the fruity flavors are light and refreshing. My favorite is the vanilla cookie pop. If you love cookie dough as much as I do, this is your pop! There's a soft cookie merged in between creamy vanilla ice cream."
1275,7/7/2016,Christine L.,houston,3,"Steel City Flop.Came here on a H O T summer day in Houston to cool down. The space is really nice and the customer service is excellent, so I'll give you points there! Everyone was really friendly! Huge space and there is even a window where you can watch them make the pops! There is a large parking lot, so no worries there.The pops were average, but you need better than average pops to survive in the Heights. $3 a pop. There are different pops you can try: Fruity or Creamy. We went with creamy expecting milky and smooth. We got three different flavors: Coffee, Coconut and Strawberry Shortcake (as recommend by one of the employees). The flavor was there but when you say a pop is 'creamy', I expect it to be rich. The Strawberry Shortcake was a little weird too. It's like uncooked shortcake inside the pop. Pass on this. Might give it another chance on the fruity bars."
1276,6/26/2017,Joann V.,houston,5,Vanilla bean. Creamy delightful dreamsicle! Great atmosphere that keep you wanting more pops for this summer weather.
1277,7/12/2016,Sue N.,houston,4,"This place is cute, hip, and all natural or organic. There's a whole room designated to just sit and chill. Seats were only available along the wall from what I saw, so there's a huge empty room for standing. There are a few benches and high seats available in the main room too. The open view to watching popsicle making is a nice addition, something to entertain you while you enjoy your pop. I tried four flavors: Coconut, Strawberry Lemonade, Coffee, and Cantaloupe. The coconut was my favorite out of these four and can be considered really really sweet. It was really creamy and the coconut flakes remind me of caramel delights. The cantaloupe was rather interesting. Immediately I thought it was way too sweet and it was not something I could chomp down fast. I had to take baby bites to enjoy it. There were also small chunks of cantaloupe in the popsicle. But I probably wouldn't order this again.Strawberry lemonade was refreshing! It has strawberry seeds sprinkled on top, so if you're allergic to strawberry seeds, do avoid. Coffee flavor needed to be a little bit stronger and creamier. Imagine eating a lighter version of haagen daz coffee. I was really expecting a strong coffee flavor and a creamy texture to be similar to that of the coconut. I will be back to try more flavors like Avocado, Chocolate and Caramel. If only these were low-cal... The 4-pop bag comes with an ice pack, however, the bag itself is not insulated so I would say 15 minutes tops would be ideal for transit time in the bag before your creamy popsicle begins to melt. This place is definitely great to bring your kids or for an after dinner dessert treat. They also serve coffee here and Provid water, where 100% of the proceeds is donated to NeverThirst."
1278,5/29/2017,Shauna R.,houston,5,Coconut popsicle dipped in dark chocolate and dredged in pistachios and drizzled with caramel. So good!
1279,8/1/2017,Kalia B.,houston,5,"Came here for the first time and all I have to say is OH.EM.GEE! I got the jalapeño/pineapple and it was soooooo good! My best friend got the avocado one but said it tasted more like key lime pie, which wasn't bad but just wasn't what she was expecting. I love how they have seasonal flavors too and are always changing it out. However, I will say that $3 a pop is a little expensive but you do get a big popsicle so I guess that makes up for it."
1280,8/12/2017,Lisa L.,houston,5,This place has the best popsicles anywhere around! I had tried steel pops in Dallas and never knew that they had opened up one close to my neighborhood in Houston so I was very excited to come and Order some popsicles to eat now and some for later LOL. And they just started doing a chocolate dip dredge and toppings plus dusting on their popsicles which I've never seen I think I will be coming to this one quite often for now on when I want a sweet treat.
1281,7/9/2016,Kimmi D.,houston,5,"As good as the one in Dallas! This location is very big with the main area where you order and pay, and then another area with more room to sit and for kids to run around, and another room where you can see them making the popsicles (which is pretty cool!). You can choose between a creamy or fruity popsicle, and each type has different variety of flavors. I came around 8pm on a Saturday and I didn't find my favorite flavors lavender lemonade or champagne white tea on the menu, so they probably ran out. Be sure to get there earlier in the day! Yay for Steel City Pops opening up here! Welcome to Houston :)"
1282,8/19/2017,Kelvin D.,houston,5,Everything is great there you can close your eyes and pick something you will not go wrong I personally like the creamy side because of the cookie.
1283,10/10/2016,Megan C.,houston,4,"Glad we decided to try this place. It was fun and they had a lot of creative flavors to choose from. I also enjoyed watching them make them. I had the blackberry basil which was really good but left lots of stuff in my teeth. I also would have liked actual tables and less kids running around. Still fun and I enjoyed it. It's a popsicle, not rocket surgery :-)"
1284,8/30/2017,Henesis M.,houston,4,"Nice place to get a much needed popsicle in this Houston heat! Definitely my go to place when I need to cool down, in the yummiest of ways :)"
1285,12/19/2016,Miso D.,houston,5,I love this place! I can't keep away! Mint chocolate and coffee are my favorite flavors! I dip my coffee in milk chocolate and coated it in pecans and drizzle with caramel!!
1286,11/7/2016,Kelsey M.,houston,5,"What a wonderful surprise to find this place in my new neighborhood!  We've been a few times and have trouble choosing from the yummy flavors and 'dressings' to go on them. I can't say I'd ever think a creamy vanilla bourbon with bacon pop would be good but I swear by how awesome it is!  They have a huge selection with dairy, non-dairy, teas, fruits and other interesting concoctions.  The staff here is very friendly. There is a free frequent shopper card. The place is clean and has a pingpong table if you're feeling Forrest Gump (this place started in Birmingham, AL). There's plenty of parking and they make the pops on site where people can watch."
1287,8/9/2017,Ileana P.,houston,5,"I arrived early one Thursday to play blanket bingo bingo in Market Square Park and there was a stand and a boy that everyone was passing up. During intermission there was a big crowd around him and I thought ""eh, let's give them a try"" I'm a sucker for ""paletas"" and as I've said before, I have high expectations coming from a Mexican background. These ""paletas"" were so good!! They had a lot of choices I couldn't make up my mind. I liked them so much I been meaning to go to their shop and buying a dozen to take home!"
1288,9/24/2016,Casey C.,houston,5,Boyfriend and I decidedly to randomly stop here and I am so glad we did! I had the peanut butter pop... and I was in peanut butter heaven. My boyfriend had the mango pop and he said it's the best he has ever had! And they're only 3$!!! The atmosphere is really nice... different types of people enjoying their pops together!
1289,7/26/2017,Kristin R.,houston,5,"This place is great. The pops are delicious and the staff is friendly. My favorite flavor so far is the blood orange. Other great flavors we've tried: cantaloupe, root beer, cucumber lime, and watermelon."
1290,"6/20/2017
            





Updated review",Kim P.,houston,5,flavor reviews;avocado; just tastes like avocado that's really it. boringstrawberry lemonade; awesome! lots of flavor!!peach; meh kinda weird; not very sweet or flavorful buttermilk; pretty good with the right amount of sweet and cookie part was good toopineapple jalapeno ; one of my favorites not overly spicy and the pineapple tastes great in a ice pop
1291,4/24/2017,Valerie H.,houston,4,"These pops are really fresh and delicious. From fruity (real fruit ingredients) to creamy (like ice cream), there's a pop for everyone. They even have options to 'dress' your pop...with sprinkles, dips, etc. Lots of benches and indoor seating, and even a dog friendly indoor patio."
1292,9/20/2016,Vanessa B.,houston,5,"Stopped in here on a Saturday afternoon. Parking was a plenty. It was sort of crowded inside, but no line to order. Ordering is super fast since they just pull your popsicles and take your money. I got the peanut butter and it was really good, husband got the strawberry lemonade and loved it. Both had lots of flavor. I think it would be fun one day to go and play ping pong there too."
1293,7/4/2017,Robyn C.,houston,5,Wow! Nice variety. Cucumber lime was really flavorful and refreshing! I'll head back pretty soon to try another flavor.
1294,12/18/2016,Joseph W.,houston,4,Pricey but goodIt's always busy on the weekends and they have a very very simple menuDon't forget they have coffee and all the hot yummy that a cold night wouldn't serve up ice cream
1295,7/1/2017,Veronica C.,houston,5,"We can't wait to go back for more!!! Reasonable prices, and great flavors. Top it off with a cool space for taking pictures and playing ping pong."
1296,7/28/2016,Ann T.,houston,3,"Being from Dallas, I didn't need to come to Steel City immediately. Waited a few weeks before checking it out and I'm certainly glad I did. There was no line when I came in Wednesday afternoon. Yay!Had the blueberry basil this time around, yum, very pulpy. Service is friendly, space is HUGE when you compare it to the Dallas location. Very clean, lots of parking and fun to watch them actually craft the popsicles. Do I think it's overpriced? Yes, but its nice to indulge every once in awhile."
1297,7/12/2017,M B.,houston,5,Finally tired these pops. I had the Strawberry Lemonade and it was so delicious and fresh. Full of strawberries with a hint of citrus. I have been craving another for days . I will be back very very soon!
1298,7/21/2016,Mi A.,houston,5,"Me and my daughter ventured out today to visit SCP....  We reviewed the menu and we both gravitated to the creamy side.... The menu is divided into creamy or juicy I would call it... she selected the Caramel pop and I selected the strawberry short cake pop.... I started reminiscing about the strawberry short cake pop I use to get from the ice cream truck but this one was way way better with a short cake inside... As for my daughter she loved her caramel pop...  As we where finishing up my daughter already planned her return selection from the juicy side ""watermelon"" and I replied I guess I will have the blood orange!"
1299,4/30/2017,Sanna A.,houston,5,Beautiful. Great freshly made popsicles you can dip in chocolates and nuts. Great side room with ping pong. Great concept. Definitely coming back!
1300,6/22/2017,Faye C.,houston,5,"The inside was super chic and cute, you can actually watch them prepare the pops in the kitchen! I've never been to a place that just sells pops but I would definitely go back. The staff was also friendly and able to answer all my questions.I bought the 4 pack with avocado (tastes literally just like a mushed avocado with lime), coconut (the toasted flakes through out were really good), peach cream (kind of like pie?) and for an extra $1 cookies and cream (super good!)!A friend of mine bought peach and she was a little disappointed that it wasn't super sweet, it's more of a natural sweetness which is better for you anyways.My only issue was that the wrappers weren't labeled and we were a little confused trying to guess by color which was which. Otherwise it was great!"
1301,8/12/2016,Christy P.,houston,5,"Do you ever drink something so delicious, you wish it came in edible form? Enter the horchata popsicle. I love horchata, and this popsicle was just as delicious as the drink...that creaminess plus the kick of cinnamon? Heavenly! I honestly can't get it off my mind. My friend's blueberry basil was delicious, but not super heavy on the basil. I tried the blood orange too and it was lighter but still tasty. Great citrus flavor that's not too bitter or sweet.They're $3 each, and they have fruity pops if you want something light and refreshing, and creamy pops if you want something more indulgent (which I almost always do). Overall...love."
1302,9/26/2016,Nicole S.,houston,5,"What's better than an ice cold popsicle to counter a hot (and humid) Houston afternoon?Great flavors and great service make Steel City one of my favorite dessert establishments!  At $3 a pop (you can save $1 if you buy a 4 pack for $11), you can satisfy your sweet tooth without breaking the bank.  PRO TIP: if you don't like your flavor, just tell the counter and they will swap it out for another flavor, free of charge.There are two types of flavors: Fruity and CreamyFruity:Seasonal fruits!  Some are sweeter than others, so make sure you ask about the sweetness level (if you prefer less sweet). - Blueberry Basil: fresh and delicious with just the right amount of sweetness - Blood Orange: great orange flavor - Passionfruit: my personal favorite of the fruity, tangy and sweet!Creamy:Rich flavors, much like ice cream!  Creamy and delicious. - Coconut: TO DIE FOR, the best flavor of the bunch.  Great coconut creaminess with flakes on the bottom - Coffee: great coffee flavor cut with just the right amount of creamI haven't tried the cookie pops yet, but looking forward to coming back and trying the Cookies and Cream and Strawberry Shortcake!!"
1303,9/26/2016,Olivia Y.,houston,4,"The place was big. The staff was informative and nice to all my questioning about the flavors. The popsicles were on point. I chose the Blueberry Basil and the bf had Coconut. Both very fresh and made of the actual ingredients. I would see myself paying the hefty price for the popsicle but not often as I'd like too :/ Either way, I'd bring my friends and/or family here because there is a separated rest area that's attached to the store that's pretty big enough to fit a large family or a group of friends (aside the other customers). It's also cool enough to not worry about your popsicle melting right then and there :)"
