,Date,UserName,Location,stars,Message
820,6/24/2015,Mel N.,dallas-2,5,"This place was packed when we walked in, and there was a long line, but it doesn't take long at all to get to the counter.It's nice and clean inside, and every popsicle you try is totally worth those $3 and however long it took you to find a parking spot.We got one cantaloupe, one passion fruit, and one coffee brownie pop. They were all so good, we wished we had a cooler to bring some back home to houston with us.The first bite of your popsicle is HEAVEN, and you STAY THERE until you finish it.The pops didn't start melting until about maybe 5 minutes later, but still held their shape.Next time, I'm going to try all the pops. ALL THE POPS."
821,8/3/2014,Jimmy-lee B.,dallas-2,5,"Like a horse to water, I was drawn to this hot new Popsicle Mecca.After passing by this lower Greenville storefront many times, I had to partake. The long lines and Popsicle hungry zombies standing around, peeked my inner fat kids interest. My only regret is that I waited so long.What an awesome new concept for Dallas! The only thing hotter than Steele City Pops, is the surface of the sun.Yes, the line can be a bit overwhelming. However, the reward will not disappoint.Choices.... Choices. So many icy cold options left me with no choice but to purchase the four for $10 deal.I devoured the vanilla bean option before a single drop melted! Perhaps the best vanilla Popsicle on Earth! My partner slowly enjoyed the avocado pop, until I decided it tasted like key lime pie and almost took off his finger in a moment of mania!Knowing two other options( peanut butter and strawberry) remained inside our thermal carry out bag, I hurried to the car. This fat kid needed the exercise!The store itself is simple. The many options are not. Staff is friendly and helpful. They even unwrapped my little treasure for me! Asked me ""how far are you traveling"" I guess this was to help them pack my extras in a thermal bag or styrofoam cooler. WOW!I'm in. I'm sold on this place! I feel sorry for the many people who walked by, saw the line, and left. Forgive them Popsicle gods for they know not what they missed!!!Crap! Now I'm hungry. Wonder what time the open?"
822,8/26/2014,Tania P.,dallas-2,5,"Dear D Magazine,Please take a moment to review your selection of Best Ice Cream in Dallas. While Carnival Barker is kitschy and started as a food truck, Steel City Pops has the same background - and can actually deliver excellent ice cream. While $3 is kinda cray for a popsicle, I happily fork it over for their great product. The coconut flavor is actually made of coconut milk; creamy, decadent, full-bodied coconut dream. The buttermilk is frozen cheesecake. Watermelon and Blood Orange is pure fruit on a stick. This is how flavors should work. Not only do they taste as promised, they also managed to use pure ingredients so it's like the frozen version of those flavors - not fake aromas. There is always a long line - so that should tell you something. It's fast-moving, and mostly due to patrons standing around blocking the doorway - presumably so they can get another one shortly after finishing their first. You can get 4 for $10. Husband and I almost double fisted it.On top of this, they have friendly, unpretentious, un-jaded employees. *FIST BUMP* I invite you to try a few flavors. Hell, I will buy them for you.Love, Tania"
823,1/31/2016,Arman K.,dallas-2,5,"Yum!!!! Ok, so yeah it's a Popsicle so don't get it twisted, BUT this is a flavorful and delicious frozen treat. The name in my opinion adds some effect to the Popsicle (it's called STEEL city I mean Steel..........like you get the picture). My all time favorite is the hibiscus and I need to give a few others an opportunity. Pomegranate is good too. They have ice based and Milk based so there is a little variety there plus the flavors. Be prepared to wait as the line for this place feels like it is long year round."
824,2/8/2015,Joanna T.,dallas-2,4,"We tried the avocado one and it tasted more like key lime pie.. We also tried their new vanilla brownie cake pop and it was delicious! It's exactly what it says, an actually brownie covered in vanilla icecream. The brownie is also soy and gluten free!"
825,10/29/2014,Thy T.,dallas-2,4,"This place has a longer line compared to the one in Fort Worth but I am guessing it's due to the location plus it's been here longer. I love the pumpkin creamy popsicle as well as the mocha. Wasn't too huge of a fan of their pomegranate or rhubarb. They have a lot of different flavors which can make deciding on something nearly impossible. I love watching people sighting while eating ice cream since there are plenty of people in that area. Overall, I love their creamy ice creams and will continue coming back!"
826,9/11/2015,M. B.,dallas-2,5,"Steel city pops... what have you done? You are undoing  my workouts! This is what normally happens... My husband and I both eat one there. Then, we bring home a 12 pack.  I personally recommend the cookie pops. They are $4.50/pop vs the regular pops which are $3/pop. The chocolate brownie and vanilla chocolate chip are definitely my favorites. It's smooth and creamy, but soft and chewy at the same time.  I've had the strawberry lemonade before and it was a little too sweet for me. Cantaloupe... not the greatest. Blah! The texture is off.  Coffee is ok.  I can't wait to try other flavors!  Maybe the next one on the list is buttermilk. Heard it's delish... :-).There's a few parking spaces (parallel parking) right up front. You can also park in the back if you are lucky enough to find a spot during peak hours. If you have trouble finding this place... it's right across Trader Joe's.  Happy eating :-)."
827,2/17/2016,Karan K.,dallas-2,4,Really great popsicles. The lines are usually pretty long here but it's always worth the wait. They have a ton of interesting and fun flavors. My personal favorite is the brownie fudge popsicle. Come here if you want to have a popping time.
828,8/8/2014,Robyn B.,dallas-2,2,"While I will always be indifferent because I was a regular at Zubar and wish they would've used the huge inside space better, the pops are decent, I wish the chocolate was more like a pudding pop!  That would be amazing!  The $1 drinks  and local talent vs the $3 pops and strangers everywhere... I don't know. I walk by daily with my dog (it's on her route) and it is great to see the flood of people reviving the area.  With people comes more trash unfortunately,  I am appalled to see morning staff power-washing their tiny patio (where I've had some of the best conversations in my life) while I am sticking to the sidewalk across the street and watching birds play with littered pop sticks.  Any available public seating on the block is sticky with pop drips and the sidewalks are all stained.  It is difficult me to welcome you to my neighborhood if you are going to treat it this way. Your lines are blocking foot traffic and there is clearly not enough space for patrons to enjoy your pops without trashing the neighborhood.  This will keep me from coming back until you fix this problem.  Best of luck."
829,10/3/2014,Nilesh C.,dallas-2,4,"There are very few places worthy enough to have their distinct identity and yet be successful. Steel City Pops is one of them.Pros:1. Unique Pop flavors. From creamy to fruity. Wide variety to choose from.2. Good ambiance of the area its located in.3. Friendly staff.Cons:1. Parking is just madness.2. Serving portion is so huge that by the end of the eating it, you are just finishing it and not loving it. The happiness quotient decreases rapidly after half of the popsicle. 3. Pricey but hey that's what gourmet food is about.All in all, definitely a go to place for more than normal occasions. But not sure if I will go  here every time I have a craving for popsicle."
830,2/1/2016,Jianbo G.,dallas-2,5,Awesome place! They change flavors according to different seasons. It's nice to hold a pop and talk a walk around the neighborhood at night.
831,9/29/2015,Justin S.,dallas-2,4,The line of tweens is always intimidating but stick with it...it's speedy. Have three or four extra dollars and you're walking home? Grab one. They're delicious.
832,1/16/2015,Tracy R.,dallas-2,5,"Whenever I'm checking out the local restaurants and bars on Greenville, I always crave the pops from Steel City. I absolutely love this place! They make the pops there (you can even see the kitchen in back where they have huge machines to make them). I always get the coffee-flavored pop, which is one of their more popular flavors. It's so creamy and it's not too sweet! It never disappoints. The cool thing about this place is that you can replace your popsicle free-of-charge if you don't like it. I remember getting the avocado the first time I went and I didn't like it too much. The staff was incredibly nice and gave me a new flavor. Really cool policy!"
833,1/5/2016,Esther R.,dallas-2,4,Best popsicles here! My fav is the Coffee one! I love the coffee powder topping thing at the top!!!! I can taste the real creaminess and I love creamy ice cream and made with fresh ingredients!
834,5/19/2015,Trang N.,dallas-2,4,"$3 for a stick of ice cream. Its a little bit pricy. It likes they make smoothie and then put it in frozen with its stick. I love something which is sour, then the strawberry lemonade is great for me. Service was fast, cashiers are very nice."
835,6/11/2015,Brittany W.,dallas-2,5,"Steel City Pops ROCKS.  Small straightforward storefront allows you to walk in, choose your flavor from the huge menu above, and order.  They take the pop out of the cooler right in front of you and take the wrapper off as well.  The menu changes daily, and all the recipes are gourmet, creative, and made right there in the kitchen.  Staff is nice too.  Never met a steel city pop i didn't like.  My faves are coffee, and cantaloupe.  I've been meaning to try the avocado pop."
836,11/23/2014,Mona B.,dallas-2,4,Steel City Pops lives up to they hype! I would recommend the carrot cake pops - its creamy and delicious and even has some pecans! The strawberry pop is probably one of the healthier ones with just 71 calories and has real strawberries. You can even get the pops dipped in chocolate! They use coconut oil so the chocolate has a hint of the coconut flavor - good add-on for the strawberry pop! For coffee lovers the coffee pop is equally good and has real espresso in it - new way to get your caffeine in!
837,8/28/2014,Dean R.,dallas-2,5,"Yeah, yeah, yeah, I know.  I'm the last person to discover this little portal into heaven.  But, I feel compelled to add my voice to the chorus of rave reviews.  As a life-long Texan, I spend my summers searching for remedies from the brutal heat.  So, on a day where you spend a great deal of time pondering the actually boiling point of brains, it's a near life-saver to stroll into Steel City Pops for an instant and delicious cool-me-down. And Oh Em Gee, the flavors!  Folks, these are not your grocery store ""popsicles"", which are pretty much frozen sugar-water on sticks.  Bleah.  No, these are deep frozen gourmet concoctions that rival any ice-cream joint in the city.  I've had a Pineapple Jalapeno that made me want to have a cigarette after...and I don't smoke.  Today, I had the Strawberry Cream, and I was instantly hurled back along the chronological age line to a birthday party for a girl I had a crush on in 6th grade, where they served pink cake and ice cream.  Both were heavy, rich, and extremely pulpy.  And OH SO flavorful!  Don't like what you see on the menu?  Come back another day, as they continually rotate flavors. Wow.  I've now been twice, and already feel like I need to find a Pops Anonymous group.  I don't care how long it takes you to find a parking spot, get your face over to Steel City Pops.  You'll change the name of that orifice between your chin and your nose to ""My Steel City Pops Hole""."
838,12/28/2015,Davis V.,dallas-2,5,"Steel city pops is a one of a kind place. Can't really find any other places in Texas that specializes in popsicles. This place offers unique and great flavors you can't just get at the frozen isle at your local krogers or Walmart. The best flavor I would have to say is the raisin rum. It's nice and sweet and you can taste a hint of rum in it. It's definitely a must try. My friends had the sweet tea. If you're a person that orders sweet tea where ever you go, that's the one for you."
839,7/16/2014,Diana D.,dallas-2,4,Buttermilk is creamy and tastes like a yogurt Popsicle. Banana Popsicle had hints of cinnamon and sugar and is quite delightful. Lines are long but fast. In n out in 10 min max. Not bad for $3 cool down. I wish I had come up with this business plan first! Parking and traffic sucks in the area so it makes me hesitant to go back or make it a destination spot unless I'm already in the area.
840,10/6/2015,Matt P.,dallas-2,5,"I'm honestly surprised that there is anything less than 5 star reviews on here. Haven't been disappointed by anything I've had here. The people leaving reviews about paying too much for popcicle need to stick to their McDonald's sundaes and get out of line so that rest of us can order the dessert on the stick goodness. Little insight, HG Sply will allow you to take Steel City Pops into their establishment next door if you prefer to enjoy your pop with a view and an adult beverage."
841,7/24/2014,Esther H.,dallas-2,3,"I'm not sure if I just came on a day that was just a little lackluster but I don't see what the hype is on Steel City Pops. Sure it's a great convenient place if you want a single cold refreshing popsicle but I just think for $3 you could go to Trader Joe's literally across the street and get a box of them for roughly the same cost. It's one of those cute places you should bring a date to after you've had a meal. With an itty bitty space and a huge following of people, Steel City Pops is kind of crowded but its a definite come and go space. You choose between a creamy or fruity type of popsicle. Opting for something a little more fruity, I chose the Hibiscus. It's a lot more sweet than citrusy and the color is a rich merlot hue. If I could just eat colors I would! I've also tried the strawberry and it is down right a good classic tasting just like strawberries. The reason I don't give it 5 stars is because I feel like this place could really push the presentation. I see people making crazy flavors mixing different unique tastes but Steel City Pops played it pretty safe. And if they made their molds more unique for cool shapes like rockets or flowers I think they would really bring popsicle places to the forefront of dessert shops."
842,6/11/2014,I W.,dallas-2,5,"I live in Plano and twice in one week I've driven to Greenville to get a popsicle because they're just that good. Steel Pop has a menu of fruity and creamy pops. They can be purchased individually or in packs of four (assorted however you prefer). They are packaged in a freezer bag that's designed to keep them cold until you get home. Although the prices are more expensive than what is sold in a store their pops are made with ingredients that you'll recognize and can pronounce (avocado, hibiscus, cucumber, blood oranges).  They are pretty popular so you'll find people (families, singles, groups) hanging out on the front patio or inside.  During both visits there were short lines but they moved quickly. I've tried both the hibiscus and blood orange flavors and my absolute favorite is the hibiscus. The beautiful color and intense flavor are wonderful, joys to my senses. During both visits the staff was super friendly and efficient.  TiP! They offer a loyalty card that you can get stamped to earn free pops."
843,8/31/2014,Joy H.,dallas-2,5,"Love Steel City! I try a new flavor every time I go and for the most part, they are delicious and refreshing. The peach is a little too sweet and tastes too much like the syrup from a can of peaches..kind of artificial tasting, but I've really enjoyed the other one's I've had-blueberry basil, watermelon, blood orange, strawberries&cream, sweet tea, avocado. Great place along Lower Greenville-definitely check it out! I love bringing out of towners here because the area has so much to offer-you could grab lunch/dinner at one of the many places along this street and then drop by for some popsicles or skip the meal and go straight for dessert."
844,9/26/2015,Thuy B.,dallas-2,4,They have a very large selection of flavors and it's a fun place to take kids or get something cold and refreshing. My favorite is the coconut. I wouldn't recommend the avocado tho. They use lime to keep the green color and it masks the avocado flavor.
845,9/6/2014,Heather S.,dallas-2,5,FRIENDLY STAFF and DELICIOUS POPSICLES! I will definitely be back! What a great concept! I can't wait for more flavors to try- being sober it's a great place to go and hang with my husband without having to eat a meal. The hangout area is cute and very family friendly for our daughter. I will still always feel awkward licking a Popsicle in public past the age of 7 but I'll get over that soon enough! ;)
846,7/30/2015,Jade S.,dallas-2,5,"BEST Popsicle around.Steel City pops has a variety of dfferent flavors made of real fruit. They also just came out with cookie pops that have cookie inside of them. Traveling far from home? No worries they provide you with bags to keep the pops cold. You can also buy them 12 at a time, mix and match your favorite.Peanut butter, avocado, just to name a few.Also a great place to stop if your walking around Greenville."
847,9/27/2014,Andrew L.,dallas-2,5,"Discovered this place after coming out of Teppo months ago for their grand opening. They were giving out free popsicle flyers which is what got me hooked. Pretty much all of their flavors are good, but their avocado and coconut are ridiculously good. Their avocado isn't a straightforward avocado since it's got plenty of lime in it. As amazing as the avocado is, I think I like the coconut even better. It's got bits of toasted coconut in it and the flavor is similar in flavor to the coconut topping of a certain Vietnamese dessert if you know what I'm talking about. It's simply amazing stuff."
848,10/20/2015,Oleta R.,dallas-2,5,Love their popsicles! I can't have dairy but there a few fruit options to choose from. It can get pretty packed inside but service is pretty fast. Great price!
849,"7/30/2015
            





Updated review",Kelly Y.,dallas-2,5,They now have Pops with a frozen Choco Chip cookie or Brownie So Good! The menu also has calories included next to each pop now too!
850,7/6/2015,Paul R.,dallas-2,5,"This is a unique and one of a kind Dallas staple. You can't go anywhere else in town for the type of pops they serve here. The cream pops are just impressive. I most recently had the coffee one, and it was wonderful. Sampling the jalapeno-pineapple was a real treat as well. It can't be beat if you're in the neighborhood on a hot day, which happens a lot here in Texas. Any Dallas resident owes it to themselves to give Steel City Pops a try at least once."
851,7/1/2014,Alice L.,dallas-2,5,So much yums in a popsicle! I like how this place offers a wide variety of flavors from fruity to creamy. I had such a hard time deciding what to get but the employee there recommended the strawberry balsamic. So delicious! It tasted like a more tart strawberry but very rich and fresh! I also tried some of the coffee pop and it was so good that I might just have to get that next time. Awesome place for a quick dessert!
852,5/19/2014,Afomia H.,dallas-2,5,"As my friend and I were engrossed in a deep conversation on the patio of Mudsmith, we noticed in our peripheral a series of contented pedestrians carrying what appeared to be ice-cream bars. By the relatively intact nature of the bars, and lack of excessive dripping, we came to the conclusion that it must be a shop on this very strip.After about the 12 person passed our table, we finally broke and asked where they had acquired these popsicles. ""It's a new store! Just there, you've gotta try it"" said an enthusiastic youth. ""I got the Sweet Tea popsicle! It takes like SWEET TEA!"" he said, still in awe.Frankly, the kid's overt excitement sealed the deal for us. We decided to check it out, hoping the store will match the hype. We approached the entrance. A helpful employee at the counter explained the history of the shop for us.  Good on Steel City for keeping well informed staff, especially in this early phase. ""All of our pops are made in store,"" he said as he pointed to a spotless kitchen behind him. He went on to tell us about the two different types of popicles they sold: cream based (like chocolate, coffee, peanut butter) and water based (the fruity flavors). I chose Vanilla Bean and my friend Lauren decided on the Blueberry Basil. It was moderately priced ($3 per pop.) I took my first lick and my high expectations were exceeded. This was the richest, most creamy piece of vanilla ice cream I have ever had in my life. Lauren agreed when we traded pops. I was rather weary of her Blueberry Basil at first, but it was simply refreshing! The store offers a myriad of interesting flavors that I cannot wait to try.I highly recommend you give this shop a try."
853,7/6/2014,Emily Y.,dallas-2,5,Tasty and convenient idea! Won't complain about the price either bc I would pay just as much for a drink or dessert that is about the same enjoyment. Line may seem long but it goes down pretty quickly.We got the fruity strawberry and milky avocado. The strawberry was just a typical but delicious strawberry fruit bar. No complaints but don't expect anything other than a fruit bar. The avocado was milky but definitely more lime flavor than anything. I was prepared for this bc of past reviews. I think they should rename it avocado lime. Both were refreshing and I would try more flavors next time. Definitely an alternative to the standard ice cream or dessert. I would recommend giving this place a try.Parking is the only minor downside. Nothing unexpected on lower Greenville though.
854,8/19/2014,Hai Yen N.,dallas-2,4,Been here twice and I really like the concept. Popsicles always bring back a sense of nostalgia to when you were younger and waiting for the ice cream truck to come to your street. These are more healthy and flavorful. I've had the hibiscus which is made without milk. Tastes like pomegranate with a hint of citrus. It's 2/3 sweet and 1/3 sour. The watermelon is refreshing and very light. The blackberry is delicious but because they leave all the seeds in there it took away from the wonderful flavor. I think overall I prefer their milk based or creamy pops better. The strawberries and cream was delicious and more smooth and fun to eat.If I'm in the area I'll definitely be back but probably won't go out of my way since parking can be a pain in that area.
855,7/12/2015,Lauren B.,dallas-2,5,"Obsessed with this place! My husband and I are out here from California and our hotel doesn't have a freezer but we typically get the 4 pack of pops and scarf them down. He loves the vanilla and brownie pop. The first visit I got the green tea with orange and it was great! Lots of true green tea flavor with the twist of citrus. The blood orange was my favorite of the fruity ones. It was so juicy and had great flavor! The passion fruit one was ok, just not as juicy as I hoped it would be. The buttermilk was amazing! I read a review that said it was like a slightly sour cream cheese with sweet vanilla tones and that's exactly what it was like! We will be making as many trips back as we can until we go back home. I will miss it when we leave :("
856,7/18/2015,Phoebe C.,dallas-2,5,"I'm a sucker for sweets so it's no surprise that Steel City Pops hits a home run for me. When my boyfriend and I visited, we were super lucky that there was no line (I've been in that area and seen the line out the door before!). Normally, I'm a big fruit flavor kind of girl but that night I was craving something sweet and chocolate. To my surprise and delight, Steel City Pops not only offers a variety of delicious fruit combinations, they also have cookie pops! Delicious combination of sweet and savory with cookies OR BROWNIES in between. My boyfriend and I both for the vanilla brownie cookie pop and after the first bite... Heaven in my mouth. It's a must try and I will definitely have to stop by to try the fruity flavors as well!"
857,"12/16/2014
            





Updated review",Ally N.,dallas-2,4,"Disregard my previous review. Steel City Pops has earned my approval. I clean around the area and decided to stop by with a group of friends after shopping. We ordered the chocolate, vanilla bean, ""divinity"" and white chocolate. Yes, I said it folks, white chocolate. My heart skipped a beat when I saw the new flavors. Most of friends loved their flavors (well one was iffy about the chocolate and said it was sour?¿). The cashier was super friendly and the place was overall very clean. Love the service, love the pops and love the location.I only wish this place closed later. I always end up wanting to go here after 10 pm."
858,6/23/2016,Billy E.,dallas-2,4,"Unique flavors and very good; was skeptical about a ""popsicle"" or ""ice pop"" but ended up getting 2 because the first one was so good and there were so many flavors I wanted to try. Workers were courteous and helpful. The pops are affordable too - about $3 I believe."
